<?xml version="1.0" encoding="UTF-8"?>
<holiday-definition xmlns:xsi="http://www.w3.org/2001/XMLSchema-instance"
                    xsi:noNamespaceSchemaLocation="../../schema/holiday-definition.xsd"
                    year="2026"
                    useYn="Y">
  <holiday date="20260505" description="어린이날"/>
  <holiday date="20260525" description="부처님오신날 대체공휴일"/>
  <holiday date="20260606" description="현충일"/>
  <holiday date="20260815" description="광복절"/>
  <holiday date="20260912" description="추석"/>
  <holiday date="20260913" description="추석"/>
  <holiday date="20261003" description="개천절"/>
  <holiday date="20261009" description="한글날"/>
  <holiday date="20261225" description="크리스마스"/>
</holiday-definition>
